Sheet: Sheet1
A1: true bearing | B1: true abs | C1: true mils | D1: mag bearing | E1: mag abs | F1: mag mils | G1: distance | H1: distanceNMi | I1: latitude | J1: longitude | K1: style | L1: color | M1: rate | N1: height | O1: visibility | P1: label | Q1: name | R1: link
A2: of:=0 -> 0 | B2: of:=MOD([.A2];360) -> 0 | C2: of:=[.B2]*17.777778 -> 0 | D2: of:=[.A2]+11.9 -> 11.9 | E2: of:=MOD([.D2];360) -> 11.9 | F2: of:=[.E2]*17.777778 -> 211.5555582 | G2: of:=0 -> 0 | H2: of:=[.G2]/1.15 -> 0 | I2: 38.784802975 | J2: -75.104300603 | K2: of:="" ->  | L2: of:="" ->  | Q2: of:="viewing location" -> viewing location
A4: of:=DEGREES(ATAN2(COS(RADIANS([.I$2]))*SIN(RADIANS([.I4]))-SIN(RADIANS([.I$2]))*COS(RADIANS([.I4]))*COS(RADIANS([.J4]-[.J$2]));SIN(RADIANS([.J4]-[.J$2]))*COS(RADIANS([.I4])))) -> -87.848924465323 | B4: of:=MOD([.A4];360) -> 272.151075534677 | C4: of:=[.B4]*17.777778 -> 4838.24140331672 | D4: of:=[.A4]+[.D$2] -> -75.948924465323 | E4: of:=MOD([.D4];360) -> 284.051075534677 | F4: of:=[.E4]*17.777778 -> 5049.79696151672 | G4: of:=ACOS(SIN(RADIANS([.I$2]))*SIN(RADIANS([.I4]))+COS(RADIANS([.I$2]))*COS(RADIANS([.I4]))*COS(RADIANS([.J4])-RADIANS([.J$2])))*3958.7 -> 0.926428924954708 | H4: of:=[.G4]/1.15 -> 0.805590369525833 | I4: 38.785305 | J4: -75.12149 | K4: of:="Fl" -> Fl | L4: of:="red" -> red | M4: of:=4 -> 4 | N4: of:=27 -> 27 | O4: of:=1 -> 1 | P4: of:="" ->  | Q4: of:="Lewes Breakwater Middle Light" -> Lewes Breakwater Middle Light
A5: of:=DEGREES(ATAN2(COS(RADIANS([.I$2]))*SIN(RADIANS([.I5]))-SIN(RADIANS([.I$2]))*COS(RADIANS([.I5]))*COS(RADIANS([.J5]-[.J$2]));SIN(RADIANS([.J5]-[.J$2]))*COS(RADIANS([.I5])))) -> -76.9078704485312 | B5: of:=MOD([.A5];360) -> 283.092129551469 | C5: of:=[.B5]*17.777778 -> 5032.74903271325 | D5: of:=[.A5]+[.D$2] -> -65.0078704485312 | E5: of:=MOD([.D5];360) -> 294.992129551469 | F5: of:=[.E5]*17.777778 -> 5244.30459091325 | G5: of:=ACOS(SIN(RADIANS([.I$2]))*SIN(RADIANS([.I5]))+COS(RADIANS([.I$2]))*COS(RADIANS([.I5]))*COS(RADIANS([.J5])-RADIANS([.J$2])))*3958.7 -> 2.85143528724717 | H5: of:=[.G5]/1.15 -> 2.47950894543232 | I5: 38.79414 | J5: -75.155875 | K5: of:="Fl" -> Fl | L5: of:="green" -> green | M5: of:=4 -> 4 | N5: of:=18 -> 18 | O5: of:=6 -> 6 | P5: of:="1R" -> 1R | Q5: of:="Roosevelt Inlet Jetty Light" -> Roosevelt Inlet Jetty Light | R5: of:="https://www.yelp.com/biz_photos/roosevelt-inlet-lewes" -> https://www.yelp.com/biz_photos/roosevelt-inlet-lewes
A6: of:=DEGREES(ATAN2(COS(RADIANS([.I$2]))*SIN(RADIANS([.I6]))-SIN(RADIANS([.I$2]))*COS(RADIANS([.I6]))*COS(RADIANS([.J6]-[.J$2]));SIN(RADIANS([.J6]-[.J$2]))*COS(RADIANS([.I6])))) -> -76.3024856238708 | B6: of:=MOD([.A6];360) -> 283.697514376129 | C6: of:=[.B6]*17.777778 -> 5043.51142973064 | D6: of:=[.A6]+[.D$2] -> -64.4024856238708 | E6: of:=MOD([.D6];360) -> 295.597514376129 | F6: of:=[.E6]*17.777778 -> 5255.06698793063 | G6: of:=ACOS(SIN(RADIANS([.I$2]))*SIN(RADIANS([.I6]))+COS(RADIANS([.I$2]))*COS(RADIANS([.I6]))*COS(RADIANS([.J6])-RADIANS([.J$2])))*3958.7 -> 2.93988216477826 | H6: of:=[.G6]/1.15 -> 2.55641927372023 | I6: 38.794866667 | J6: -75.157341667 | K6: of:="Fl" -> Fl | L6: of:="red" -> red | M6: of:=4 -> 4 | N6: of:=18 -> 18 | O6: of:=6 -> 6 | P6: of:="2" -> 2 | Q6: of:="Roosevelt Inlet Jetty Light" -> Roosevelt Inlet Jetty Light | R6: of:="https://www.yelp.com/biz_photos/roosevelt-inlet-lewes" -> https://www.yelp.com/biz_photos/roosevelt-inlet-lewes
A7: of:=DEGREES(ATAN2(COS(RADIANS([.I$2]))*SIN(RADIANS([.I7]))-SIN(RADIANS([.I$2]))*COS(RADIANS([.I7]))*COS(RADIANS([.J7]-[.J$2]));SIN(RADIANS([.J7]-[.J$2]))*COS(RADIANS([.I7])))) -> -74.6676725451642 | B7: of:=MOD([.A7];360) -> 285.332327454836 | C7: of:=[.B7]*17.777778 -> 5072.57477371538 | D7: of:=[.A7]+[.D$2] -> -62.7676725451642 | E7: of:=MOD([.D7];360) -> 297.232327454836 | F7: of:=[.E7]*17.777778 -> 5284.13033191538 | G7: of:=ACOS(SIN(RADIANS([.I$2]))*SIN(RADIANS([.I7]))+COS(RADIANS([.I$2]))*COS(RADIANS([.I7]))*COS(RADIANS([.J7])-RADIANS([.J$2])))*3958.7 -> 0.776371170362981 | H7: of:=[.G7]/1.15 -> 0.675105365533027 | I7: 38.787773333 | J7: -75.118203333 | K7: of:="Iso" -> Iso | L7: of:="red" -> red | M7: of:=4 -> 4 | N7: of:=49 -> 49 | O7: of:=1 -> 1 | P7: of:="" ->  | Q7: of:="Lewes Breakwater Front Light" -> Lewes Breakwater Front Light | R7: of:="https://www.tripadvisor.com/LocationPhotoDirectLink-g34028-d1640435-i101517389-Lewes_Beach-Lewes_Delaware.html" -> https://www.tripadvisor.com/LocationPhotoDirectLink-g34028-d1640435-i101517389-Lewes_Beach-Lewes_Delaware.html
A8: of:=DEGREES(ATAN2(COS(RADIANS([.I$2]))*SIN(RADIANS([.I8]))-SIN(RADIANS([.I$2]))*COS(RADIANS([.I8]))*COS(RADIANS([.J8]-[.J$2]));SIN(RADIANS([.J8]-[.J$2]))*COS(RADIANS([.I8])))) -> -61.1455141597097 | B8: of:=MOD([.A8];360) -> 298.85448584029 | C8: of:=[.B8]*17.777778 -> 5312.96870357283 | D8: of:=[.A8]+[.D$2] -> -49.2455141597097 | E8: of:=MOD([.D8];360) -> 310.75448584029 | F8: of:=[.E8]*17.777778 -> 5524.52426177282 | G8: of:=ACOS(SIN(RADIANS([.I$2]))*SIN(RADIANS([.I8]))+COS(RADIANS([.I$2]))*COS(RADIANS([.I8]))*COS(RADIANS([.J8])-RADIANS([.J$2])))*3958.7 -> 1.68754049033161 | H8: of:=[.G8]/1.15 -> 1.46742651333183 | I8: 38.796586667 | J8: -75.131748333 | K8: of:="Fl" -> Fl | L8: of:="white" -> white | M8: of:=4 -> 4 | N8: of:=1 -> 1 | O8: of:=1 -> 1 | P8: of:="CG" -> CG | Q8: of:="Harbor of Refuge Lighted Mooring Buoy" -> Harbor of Refuge Lighted Mooring Buoy
A9: of:=DEGREES(ATAN2(COS(RADIANS([.I$2]))*SIN(RADIANS([.I9]))-SIN(RADIANS([.I$2]))*COS(RADIANS([.I9]))*COS(RADIANS([.J9]-[.J$2]));SIN(RADIANS([.J9]-[.J$2]))*COS(RADIANS([.I9])))) -> -44.7757870330182 | B9: of:=MOD([.A9];360) -> 315.224212966982 | C9: of:=[.B9]*17.777778 -> 5603.98607835172 | D9: of:=[.A9]+[.D$2] -> -32.8757870330182 | E9: of:=MOD([.D9];360) -> 327.124212966982 | F9: of:=[.E9]*17.777778 -> 5815.54163655173 | G9: of:=ACOS(SIN(RADIANS([.I$2]))*SIN(RADIANS([.I9]))+COS(RADIANS([.I$2]))*COS(RADIANS([.I9]))*COS(RADIANS([.J9])-RADIANS([.J$2])))*3958.7 -> 14.7925913063958 | H9: of:=[.G9]/1.15 -> 12.8631228751268 | I9: 38.936625 | J9: -75.298166667 | K9: of:="Fl" -> Fl | L9: of:="green" -> green | M9: of:=4 -> 4 | N9: of:=25 -> 25 | O9: of:=6 -> 6 | P9: of:="1M" -> 1M | Q9: of:="Mispillion Inlet South Jetty Light" -> Mispillion Inlet South Jetty Light | R9: of:="https://www.delaware-surf-fishing.com/surf-fishing-101/mispillion-river-entrance-tide-chart-2019/dsc_0055-copy-2/" -> https://www.delaware-surf-fishing.com/surf-fishing-101/mispillion-river-entrance-tide-chart-2019/dsc_0055-copy-2/
A10: of:=DEGREES(ATAN2(COS(RADIANS([.I$2]))*SIN(RADIANS([.I10]))-SIN(RADIANS([.I$2]))*COS(RADIANS([.I10]))*COS(RADIANS([.J10]-[.J$2]));SIN(RADIANS([.J10]-[.J$2]))*COS(RADIANS([.I10])))) -> -44.6410601986382 | B10: of:=MOD([.A10];360) -> 315.358939801362 | C10: of:=[.B10]*17.777778 -> 5606.38122210397 | D10: of:=[.A10]+[.D$2] -> -32.7410601986382 | E10: of:=MOD([.D10];360) -> 327.258939801362 | F10: of:=[.E10]*17.777778 -> 5817.93678030398 | G10: of:=ACOS(SIN(RADIANS([.I$2]))*SIN(RADIANS([.I10]))+COS(RADIANS([.I$2]))*COS(RADIANS([.I10]))*COS(RADIANS([.J10])-RADIANS([.J$2])))*3958.7 -> 14.811087271984 | H10: of:=[.G10]/1.15 -> 12.8792063234643 | I10: 38.93717 | J10: -75.29795 | K10: of:="Fl" -> Fl | L10: of:="red" -> red | M10: of:=4 -> 4 | N10: of:=25 -> 25 | O10: of:=6 -> 6 | P10: of:="2" -> 2 | Q10: of:="Mispillion Inlet North Jetty Light" -> Mispillion Inlet North Jetty Light | R10: of:="https://www.delaware-surf-fishing.com/surf-fishing-101/mispillion-river-entrance-tide-chart-2019/dsc_0055-copy-2/" -> https://www.delaware-surf-fishing.com/surf-fishing-101/mispillion-river-entrance-tide-chart-2019/dsc_0055-copy-2/
A12: of:=DEGREES(ATAN2(COS(RADIANS([.I$2]))*SIN(RADIANS([.I12]))-SIN(RADIANS([.I$2]))*COS(RADIANS([.I12]))*COS(RADIANS([.J12]-[.J$2]));SIN(RADIANS([.J12]-[.J$2]))*COS(RADIANS([.I12])))) -> -31.5182194276238 | B12: of:=MOD([.A12];360) -> 328.481780572376 | C12: of:=[.B12]*17.777778 -> 5839.67617206042 | D12: of:=[.A12]+[.D$2] -> -19.6182194276238 | E12: of:=MOD([.D12];360) -> 340.381780572376 | F12: of:=[.E12]*17.777778 -> 6051.23173026042 | G12: of:=ACOS(SIN(RADIANS([.I$2]))*SIN(RADIANS([.I12]))+COS(RADIANS([.I$2]))*COS(RADIANS([.I12]))*COS(RADIANS([.J12])-RADIANS([.J$2])))*3958.7 -> 1.27268957335093 | H12: of:=[.G12]/1.15 -> 1.10668658552255 | I12: 38.800505 | J12: -75.116656667 | K12: of:="Fl" -> Fl | L12: of:="green" -> green | M12: of:=4 -> 4 | N12: of:=45 -> 45 | O12: of:=7 -> 7 | P12: of:="3" -> 3 | Q12: of:="Delaware Breakwater West End Light" -> Delaware Breakwater West End Light | R12: of:="http://listoflights.org/images/leuchtfeuer/gross/J12812.jpg" -> http://listoflights.org/images/leuchtfeuer/gross/J12812.jpg
A13: of:=DEGREES(ATAN2(COS(RADIANS([.I$2]))*SIN(RADIANS([.I13]))-SIN(RADIANS([.I$2]))*COS(RADIANS([.I13]))*COS(RADIANS([.J13]-[.J$2]));SIN(RADIANS([.J13]-[.J$2]))*COS(RADIANS([.I13])))) -> -24.7710359744532 | B13: of:=MOD([.A13];360) -> 335.228964025547 | C13: of:=[.B13]*17.777778 -> 5959.62610161616 | D13: of:=[.A13]+[.D$2] -> -12.8710359744532 | E13: of:=MOD([.D13];360) -> 347.128964025547 | F13: of:=[.E13]*17.777778 -> 6171.18165981616 | G13: of:=ACOS(SIN(RADIANS([.I$2]))*SIN(RADIANS([.I13]))+COS(RADIANS([.I$2]))*COS(RADIANS([.I13]))*COS(RADIANS([.J13])-RADIANS([.J$2])))*3958.7 -> 12.6877775979397 | H13: of:=[.G13]/1.15 -> 11.032850085165 | I13: 38.9515 | J13: -75.203238333 | K13: of:="Fl" -> Fl | L13: of:="yellow" -> yellow | M13: of:=6 -> 6 | N13: of:=1 -> 1 | O13: of:=1 -> 1 | P13: of:="B" -> B | Q13: of:="Big Stone Beach Tanker Anchorage Lighted Buoy" -> Big Stone Beach Tanker Anchorage Lighted Buoy
A14: of:=DEGREES(ATAN2(COS(RADIANS([.I$2]))*SIN(RADIANS([.I14]))-SIN(RADIANS([.I$2]))*COS(RADIANS([.I14]))*COS(RADIANS([.J14]-[.J$2]));SIN(RADIANS([.J14]-[.J$2]))*COS(RADIANS([.I14])))) -> -18.0741652221124 | B14: of:=MOD([.A14];360) -> 341.925834777888 | C14: of:=[.B14]*17.777778 -> 6078.68158314597 | D14: of:=[.A14]+[.D$2] -> -6.1741652221124 | E14: of:=MOD([.D14];360) -> 353.825834777888 | F14: of:=[.E14]*17.777778 -> 6290.23714134597 | G14: of:=ACOS(SIN(RADIANS([.I$2]))*SIN(RADIANS([.I14]))+COS(RADIANS([.I$2]))*COS(RADIANS([.I14]))*COS(RADIANS([.J14])-RADIANS([.J$2])))*3958.7 -> 12.8029661682443 | H14: of:=[.G14]/1.15 -> 11.1330140593429 | I14: 38.960938333 | J14: -75.178235 | K14: of:="Fl" -> Fl | L14: of:="yellow" -> yellow | M14: of:=4 -> 4 | N14: of:=1 -> 1 | O14: of:=1 -> 1 | P14: of:="G" -> G | Q14: of:="Big Stone Beach Tanker Anchorage Lighted Buoy" -> Big Stone Beach Tanker Anchorage Lighted Buoy
A15: of:=DEGREES(ATAN2(COS(RADIANS([.I$2]))*SIN(RADIANS([.I15]))-SIN(RADIANS([.I$2]))*COS(RADIANS([.I15]))*COS(RADIANS([.J15]-[.J$2]));SIN(RADIANS([.J15]-[.J$2]))*COS(RADIANS([.I15])))) -> -17.7481782442188 | B15: of:=MOD([.A15];360) -> 342.251821755781 | C15: of:=[.B15]*17.777778 -> 6084.47690726985 | D15: of:=[.A15]+[.D$2] -> -5.8481782442188 | E15: of:=MOD([.D15];360) -> 354.151821755781 | F15: of:=[.E15]*17.777778 -> 6296.03246546985 | G15: of:=ACOS(SIN(RADIANS([.I$2]))*SIN(RADIANS([.I15]))+COS(RADIANS([.I$2]))*COS(RADIANS([.I15]))*COS(RADIANS([.J15])-RADIANS([.J$2])))*3958.7 -> 28.8393257448786 | H15: of:=[.G15]/1.15 -> 25.077674560764 | I15: 39.182225 | J15: -75.268448333 | K15: of:="Iso" -> Iso | L15: of:="white" -> white | M15: of:=6 -> 6 | N15: of:=61 -> 61 | O15: of:=16 -> 16 | P15: of:="" ->  | Q15: of:="Elbow of Cross Ledge Light" -> Elbow of Cross Ledge Light | R15: of:="https://en.wikipedia.org/wiki/Elbow_of_Cross_Ledge_Light" -> https://en.wikipedia.org/wiki/Elbow_of_Cross_Ledge_Light
A16: of:=DEGREES(ATAN2(COS(RADIANS([.I$2]))*SIN(RADIANS([.I16]))-SIN(RADIANS([.I$2]))*COS(RADIANS([.I16]))*COS(RADIANS([.J16]-[.J$2]));SIN(RADIANS([.J16]-[.J$2]))*COS(RADIANS([.I16])))) -> -13.3245378727024 | B16: of:=MOD([.A16];360) -> 346.675462127298 | C16: of:=[.B16]*17.777778 -> 6163.11940374651 | D16: of:=[.A16]+[.D$2] -> -1.4245378727024 | E16: of:=MOD([.D16];360) -> 358.575462127298 | F16: of:=[.E16]*17.777778 -> 6374.67496194651 | G16: of:=ACOS(SIN(RADIANS([.I$2]))*SIN(RADIANS([.I16]))+COS(RADIANS([.I$2]))*COS(RADIANS([.I16]))*COS(RADIANS([.J16])-RADIANS([.J$2])))*3958.7 -> 24.2755915517797 | H16: of:=[.G16]/1.15 -> 21.1092100450258 | I16: 39.126648333 | J16: -75.208681667 | K16: of:="Oc" -> Oc | L16: of:="white" -> white | M16: of:=4 -> 4 | N16: of:=59 -> 59 | O16: of:=10 -> 10 | P16: of:="" ->  | Q16: of:="Miah Maull Shoal Light" -> Miah Maull Shoal Light | R16: of:="https://en.wikipedia.org/wiki/Miah_Maull_Shoal_Light" -> https://en.wikipedia.org/wiki/Miah_Maull_Shoal_Light
A17: of:=DEGREES(ATAN2(COS(RADIANS([.I$2]))*SIN(RADIANS([.I17]))-SIN(RADIANS([.I$2]))*COS(RADIANS([.I17]))*COS(RADIANS([.J17]-[.J$2]));SIN(RADIANS([.J17]-[.J$2]))*COS(RADIANS([.I17])))) -> -13.0966997051752 | B17: of:=MOD([.A17];360) -> 346.903300294825 | C17: of:=[.B17]*17.777778 -> 6167.16986010873 | D17: of:=[.A17]+[.D$2] -> -1.1966997051752 | E17: of:=MOD([.D17];360) -> 358.803300294825 | F17: of:=[.E17]*17.777778 -> 6378.72541830873 | G17: of:=ACOS(SIN(RADIANS([.I$2]))*SIN(RADIANS([.I17]))+COS(RADIANS([.I$2]))*COS(RADIANS([.I17]))*COS(RADIANS([.J17])-RADIANS([.J$2])))*3958.7 -> 3.61282415513587 | H17: of:=[.G17]/1.15 -> 3.14158622185728 | I17: 38.835731667 | J17: -75.119511667 | K17: of:="Fl" -> Fl | L17: of:="white" -> white | M17: of:=4 -> 4 | N17: of:=22 -> 22 | O17: of:=6 -> 6 | P17: of:="W" -> W | Q17: of:="Delaware Bay West Icebreaker Light" -> Delaware Bay West Icebreaker Light
A18: of:=DEGREES(ATAN2(COS(RADIANS([.I$2]))*SIN(RADIANS([.I18]))-SIN(RADIANS([.I$2]))*COS(RADIANS([.I18]))*COS(RADIANS([.J18]-[.J$2]));SIN(RADIANS([.J18]-[.J$2]))*COS(RADIANS([.I18])))) -> -12.9325093496226 | B18: of:=MOD([.A18];360) -> 347.067490650377 | C18: of:=[.B18]*17.777778 -> 6170.08879979949 | D18: of:=[.A18]+[.D$2] -> -1.0325093496226 | E18: of:=MOD([.D18];360) -> 358.967490650377 | F18: of:=[.E18]*17.777778 -> 6381.64435799949 | G18: of:=ACOS(SIN(RADIANS([.I$2]))*SIN(RADIANS([.I18]))+COS(RADIANS([.I$2]))*COS(RADIANS([.I18]))*COS(RADIANS([.J18])-RADIANS([.J$2])))*3958.7 -> 18.6777297501151 | H18: of:=[.G18]/1.15 -> 16.2415041305349 | I18: 39.04825 | J18: -75.182203333 | K18: of:="Fl" -> Fl | L18: of:="red" -> red | M18: of:=9.5 -> 9.5 | N18: of:=59 -> 59 | O18: of:=10 -> 10 | P18: of:="" ->  | Q18: of:="Fourteen Foot Bank Light" -> Fourteen Foot Bank Light | R18: of:="https://en.wikipedia.org/wiki/Fourteen_Foot_Bank_Light" -> https://en.wikipedia.org/wiki/Fourteen_Foot_Bank_Light
A19: of:=DEGREES(ATAN2(COS(RADIANS([.I$2]))*SIN(RADIANS([.I19]))-SIN(RADIANS([.I$2]))*COS(RADIANS([.I19]))*COS(RADIANS([.J19]-[.J$2]));SIN(RADIANS([.J19]-[.J$2]))*COS(RADIANS([.I19])))) -> -12.265472062286 | B19: of:=MOD([.A19];360) -> 347.734527937714 | C19: of:=[.B19]*17.777778 -> 6181.94724061148 | D19: of:=[.A19]+[.D$2] -> -0.365472062285999 | E19: of:=MOD([.D19];360) -> 359.634527937714 | F19: of:=[.E19]*17.777778 -> 6393.50279881148 | G19: of:=ACOS(SIN(RADIANS([.I$2]))*SIN(RADIANS([.I19]))+COS(RADIANS([.I$2]))*COS(RADIANS([.I19]))*COS(RADIANS([.J19])-RADIANS([.J$2])))*3958.7 -> 7.95702143612676 | H19: of:=[.G19]/1.15 -> 6.91914907489283 | I19: 38.897335 | J19: -75.135736667 | K19: of:="Fl" -> Fl | L19: of:="yellow" -> yellow | M19: of:=2.5 -> 2.5 | N19: of:=1 -> 1 | O19: of:=1 -> 1 | P19: of:="A" -> A | Q19: of:="Big Stone Beach Tanker Anchorage Lighted Buoy" -> Big Stone Beach Tanker Anchorage Lighted Buoy
A20: of:=DEGREES(ATAN2(COS(RADIANS([.I$2]))*SIN(RADIANS([.I20]))-SIN(RADIANS([.I$2]))*COS(RADIANS([.I20]))*COS(RADIANS([.J20]-[.J$2]));SIN(RADIANS([.J20]-[.J$2]))*COS(RADIANS([.I20])))) -> -9.20259747248611 | B20: of:=MOD([.A20];360) -> 350.797402527514 | C20: of:=[.B20]*17.777778 -> 6236.39834511078 | D20: of:=[.A20]+[.D$2] -> 2.69740252751389 | E20: of:=MOD([.D20];360) -> 2.69740252751389 | F20: of:=[.E20]*17.777778 -> 47.9538233107808 | G20: of:=ACOS(SIN(RADIANS([.I$2]))*SIN(RADIANS([.I20]))+COS(RADIANS([.I$2]))*COS(RADIANS([.I20]))*COS(RADIANS([.J20])-RADIANS([.J$2])))*3958.7 -> 17.559575504361 | H20: of:=[.G20]/1.15 -> 15.2691960907487 | I20: 39.035666667 | J20: -75.156626667 | K20: of:="Fl" -> Fl | L20: of:="red" -> red | M20: of:=4 -> 4 | N20: of:=1 -> 1 | O20: of:=1 -> 1 | P20: of:="16" -> 16 | Q20: of:="Delaware Bay Main Channel Lighted Buoy" -> Delaware Bay Main Channel Lighted Buoy
A21: of:=DEGREES(ATAN2(COS(RADIANS([.I$2]))*SIN(RADIANS([.I21]))-SIN(RADIANS([.I$2]))*COS(RADIANS([.I21]))*COS(RADIANS([.J21]-[.J$2]));SIN(RADIANS([.J21]-[.J$2]))*COS(RADIANS([.I21])))) -> -7.21895105520255 | B21: of:=MOD([.A21];360) -> 352.781048944797 | C21: of:=[.B21]*17.777778 -> 6271.66317074774 | D21: of:=[.A21]+[.D$2] -> 4.68104894479745 | E21: of:=MOD([.D21];360) -> 4.68104894479745 | F21: of:=[.E21]*17.777778 -> 83.2186489477433 | G21: of:=ACOS(SIN(RADIANS([.I$2]))*SIN(RADIANS([.I21]))+COS(RADIANS([.I$2]))*COS(RADIANS([.I21]))*COS(RADIANS([.J21])-RADIANS([.J$2])))*3958.7 -> 15.3436503216872 | H21: of:=[.G21]/1.15 -> 13.3423046275541 | I21: 39.005111667 | J21: -75.140211667 | K21: of:="Fl" -> Fl | L21: of:="red" -> red | M21: of:=2.5 -> 2.5 | N21: of:=1 -> 1 | O21: of:=1 -> 1 | P21: of:="14" -> 14 | Q21: of:="Delaware Bay Main Channel Lighted Buoy" -> Delaware Bay Main Channel Lighted Buoy
A22: of:=DEGREES(ATAN2(COS(RADIANS([.I$2]))*SIN(RADIANS([.I22]))-SIN(RADIANS([.I$2]))*COS(RADIANS([.I22]))*COS(RADIANS([.J22]-[.J$2]));SIN(RADIANS([.J22]-[.J$2]))*COS(RADIANS([.I22])))) -> -5.5153871239085 | B22: of:=MOD([.A22];360) -> 354.484612876091 | C22: of:=[.B22]*17.777778 -> 6301.9487521271 | D22: of:=[.A22]+[.D$2] -> 6.3846128760915 | E22: of:=MOD([.D22];360) -> 6.3846128760915 | F22: of:=[.E22]*17.777778 -> 113.504230327096 | G22: of:=ACOS(SIN(RADIANS([.I$2]))*SIN(RADIANS([.I22]))+COS(RADIANS([.I$2]))*COS(RADIANS([.I22]))*COS(RADIANS([.J22])-RADIANS([.J$2])))*3958.7 -> 3.71205144367422 | H22: of:=[.G22]/1.15 -> 3.22787082058628 | I22: 38.83828 | J22: -75.11093 | K22: of:="Q" -> Q | L22: of:="red" -> red | M22: of:=1 -> 1 | N22: of:=15 -> 15 | O22: of:=6 -> 6 | P22: of:="2" -> 2 | Q22: of:="Delaware Bay East Icebreaker Light (out)" -> Delaware Bay East Icebreaker Light (out)
A23: of:=DEGREES(ATAN2(COS(RADIANS([.I$2]))*SIN(RADIANS([.I23]))-SIN(RADIANS([.I$2]))*COS(RADIANS([.I23]))*COS(RADIANS([.J23]-[.J$2]));SIN(RADIANS([.J23]-[.J$2]))*COS(RADIANS([.I23])))) -> -5.10031667557667 | B23: of:=MOD([.A23];360) -> 354.899683324423 | C23: of:=[.B23]*17.777778 -> 6309.3277824119 | D23: of:=[.A23]+[.D$2] -> 6.79968332442333 | E23: of:=MOD([.D23];360) -> 6.79968332442333 | F23: of:=[.E23]*17.777778 -> 120.8832606119 | G23: of:=ACOS(SIN(RADIANS([.I$2]))*SIN(RADIANS([.I23]))+COS(RADIANS([.I$2]))*COS(RADIANS([.I23]))*COS(RADIANS([.J23])-RADIANS([.J$2])))*3958.7 -> 13.621310781969 | H23: of:=[.G23]/1.15 -> 11.8446180712774 | I23: 38.981166667 | J23: -75.126846667 | K23: of:="Fl" -> Fl | L23: of:="red" -> red | M23: of:=4 -> 4 | N23: of:=1 -> 1 | O23: of:=1 -> 1 | P23: of:="12" -> 12 | Q23: of:="Delaware Bay Main Channel Lighted Buoy" -> Delaware Bay Main Channel Lighted Buoy
A24: of:=DEGREES(ATAN2(COS(RADIANS([.I$2]))*SIN(RADIANS([.I24]))-SIN(RADIANS([.I$2]))*COS(RADIANS([.I24]))*COS(RADIANS([.J24]-[.J$2]));SIN(RADIANS([.J24]-[.J$2]))*COS(RADIANS([.I24])))) -> -1.96248231062982 | B24: of:=MOD([.A24];360) -> 358.03751768937 | C24: of:=[.B24]*17.777778 -> 6365.1115051527 | D24: of:=[.A24]+[.D$2] -> 9.93751768937018 | E24: of:=MOD([.D24];360) -> 9.93751768937018 | F24: of:=[.E24]*17.777778 -> 176.666983352696 | G24: of:=ACOS(SIN(RADIANS([.I$2]))*SIN(RADIANS([.I24]))+COS(RADIANS([.I$2]))*COS(RADIANS([.I24]))*COS(RADIANS([.J24])-RADIANS([.J$2])))*3958.7 -> 13.9252571571536 | H24: of:=[.G24]/1.15 -> 12.1089192670901 | I24: 38.98623 | J24: -75.11318 | K24: of:="Fl" -> Fl | L24: of:="white" -> white | M24: of:=10 -> 10 | N24: of:=60 -> 60 | O24: of:=13 -> 13 | P24: of:="" ->  | Q24: of:="Brandywine Shoal Light" -> Brandywine Shoal Light | R24: of:="https://en.wikipedia.org/wiki/Brandywine_Shoal_Light" -> https://en.wikipedia.org/wiki/Brandywine_Shoal_Light
A25: of:=DEGREES(ATAN2(COS(RADIANS([.I$2]))*SIN(RADIANS([.I25]))-SIN(RADIANS([.I$2]))*COS(RADIANS([.I25]))*COS(RADIANS([.J25]-[.J$2]));SIN(RADIANS([.J25]-[.J$2]))*COS(RADIANS([.I25])))) -> -1.35954374022724 | B25: of:=MOD([.A25];360) -> 358.640456259773 | C25: of:=[.B25]*17.777778 -> 6375.83041320495 | D25: of:=[.A25]+[.D$2] -> 10.5404562597728 | E25: of:=MOD([.D25];360) -> 10.5404562597728 | F25: of:=[.E25]*17.777778 -> 187.38589140495 | G25: of:=ACOS(SIN(RADIANS([.I$2]))*SIN(RADIANS([.I25]))+COS(RADIANS([.I$2]))*COS(RADIANS([.I25]))*COS(RADIANS([.J25])-RADIANS([.J$2])))*3958.7 -> 3.30299371860407 | H25: of:=[.G25]/1.15 -> 2.87216845096006 | I25: 38.832595 | J25: -75.105756667 | K25: of:="Fl" -> Fl | L25: of:="green" -> green | M25: of:=4 -> 4 | N25: of:=40 -> 40 | O25: of:=7 -> 7 | P25: of:="1" -> 1 | Q25: of:="Harbor of Refuge North End Light" -> Harbor of Refuge North End Light
A26: of:=DEGREES(ATAN2(COS(RADIANS([.I$2]))*SIN(RADIANS([.I26]))-SIN(RADIANS([.I$2]))*COS(RADIANS([.I26]))*COS(RADIANS([.J26]-[.J$2]));SIN(RADIANS([.J26]-[.J$2]))*COS(RADIANS([.I26])))) -> -0.151329344671077 | B26: of:=MOD([.A26];360) -> 359.848670655329 | C26: of:=[.B26]*17.777778 -> 6397.30978050555 | D26: of:=[.A26]+[.D$2] -> 11.7486706553289 | E26: of:=MOD([.D26];360) -> 11.7486706553289 | F26: of:=[.E26]*17.777778 -> 208.865258705552 | G26: of:=ACOS(SIN(RADIANS([.I$2]))*SIN(RADIANS([.I26]))+COS(RADIANS([.I$2]))*COS(RADIANS([.I26]))*COS(RADIANS([.J26])-RADIANS([.J$2])))*3958.7 -> 10.7377042431023 | H26: of:=[.G26]/1.15 -> 9.33713412443678 | I26: 38.940213333 | J26: -75.104828333 | K26: of:="Fl" -> Fl | L26: of:="red" -> red | M26: of:=4.4 -> 4.4 | N26: of:=1 -> 1 | O26: of:=1 -> 1 | P26: of:="10" -> 10 | Q26: of:="Delaware Bay Main Channel Lighted Buoy" -> Delaware Bay Main Channel Lighted Buoy
A27: of:=DEGREES(ATAN2(COS(RADIANS([.I$2]))*SIN(RADIANS([.I27]))-SIN(RADIANS([.I$2]))*COS(RADIANS([.I27]))*COS(RADIANS([.J27]-[.J$2]));SIN(RADIANS([.J27]-[.J$2]))*COS(RADIANS([.I27])))) -> 1.33358705959974 | B27: of:=MOD([.A27];360) -> 1.33358705959974 | C27: of:=[.B27]*17.777778 -> 23.7082146892369 | D27: of:=[.A27]+[.D$2] -> 13.2335870595997 | E27: of:=MOD([.D27];360) -> 13.2335870595997 | F27: of:=[.E27]*17.777778 -> 235.263772889237 | G27: of:=ACOS(SIN(RADIANS([.I$2]))*SIN(RADIANS([.I27]))+COS(RADIANS([.I$2]))*COS(RADIANS([.I27]))*COS(RADIANS([.J27])-RADIANS([.J$2])))*3958.7 -> 9.51719986241902 | H27: of:=[.G27]/1.15 -> 8.27582596732089 | I27: 38.922511667 | J27: -75.10018 | K27: of:="Fl" -> Fl | L27: of:="white" -> white | M27: of:=2.5 -> 2.5 | N27: of:=23 -> 23 | O27: of:=7 -> 7 | P27: of:="" ->  | Q27: of:="Brown Shoal Light" -> Brown Shoal Light | R27: of:="https://www.lightphotos.net/photos/displayimage.php?album=203&pid=36104" -> https://www.lightphotos.net/photos/displayimage.php?album=203&pid=36104
A28: of:=6 -> 6 | B28: of:=MOD([.A28];360) -> 6 | C28: of:=[.B28]*17.777778 -> 106.666668 | D28: of:=[.A28]+[.D$2] -> 17.9 | E28: of:=MOD([.D28];360) -> 17.9 | F28: of:=[.E28]*17.777778 -> 318.2222262 | G28: of:=0 -> 0 | H28: of:=0 -> 0 | I28: of:=0 -> 0 | J28: of:=0 -> 0 | K28: of:="Fl" -> Fl | L28: of:="red" -> red | M28: of:=2 -> 2 | N28: of:=0 -> 0 | O28: of:=0 -> 0 | P28: of:="" ->  | Q28: of:="unknown (azimuth approx.)" -> unknown (azimuth approx.)
A29: of:=DEGREES(ATAN2(COS(RADIANS([.I$2]))*SIN(RADIANS([.I29]))-SIN(RADIANS([.I$2]))*COS(RADIANS([.I29]))*COS(RADIANS([.J29]-[.J$2]));SIN(RADIANS([.J29]-[.J$2]))*COS(RADIANS([.I29])))) -> 15.3128249159169 | B29: of:=MOD([.A29];360) -> 15.3128249159169 | C29: of:=[.B29]*17.777778 -> 272.22800190804 | D29: of:=[.A29]+[.D$2] -> 27.2128249159169 | E29: of:=MOD([.D29];360) -> 27.2128249159169 | F29: of:=[.E29]*17.777778 -> 483.78356010804 | G29: of:=ACOS(SIN(RADIANS([.I$2]))*SIN(RADIANS([.I29]))+COS(RADIANS([.I$2]))*COS(RADIANS([.I29]))*COS(RADIANS([.J29])-RADIANS([.J$2])))*3958.7 -> 0.882342333018245 | H29: of:=[.G29]/1.15 -> 0.76725420262456 | I29: 38.79712 | J29: -75.099973333 | K29: of:="" ->  | L29: of:="" ->  | M29: of:=0 -> 0 | N29: of:=61 -> 61 | O29: of:=0 -> 0 | P29: of:="" ->  | Q29: of:="Delaware Breakwater East End Light" -> Delaware Breakwater East End Light
A30: of:=DEGREES(ATAN2(COS(RADIANS([.I$2]))*SIN(RADIANS([.I30]))-SIN(RADIANS([.I$2]))*COS(RADIANS([.I30]))*COS(RADIANS([.J30]-[.J$2]));SIN(RADIANS([.J30]-[.J$2]))*COS(RADIANS([.I30])))) -> 17.3494244943841 | B30: of:=MOD([.A30];360) -> 17.3494244943841 | C30: of:=[.B30]*17.777778 -> 308.434217088923 | D30: of:=[.A30]+[.D$2] -> 29.2494244943841 | E30: of:=MOD([.D30];360) -> 29.2494244943841 | F30: of:=[.E30]*17.777778 -> 519.989775288923 | G30: of:=ACOS(SIN(RADIANS([.I$2]))*SIN(RADIANS([.I30]))+COS(RADIANS([.I$2]))*COS(RADIANS([.I30]))*COS(RADIANS([.J30])-RADIANS([.J$2])))*3958.7 -> 2.15028421883561 | H30: of:=[.G30]/1.15 -> 1.86981236420488 | I30: 38.814508333 | J30: -75.09239 | K30: of:="Fl" -> Fl | L30: of:="white" -> white | M30: of:=10 -> 10 | N30: of:=72 -> 72 | O30: of:=19 -> 19 | P30: of:="" ->  | Q30: of:="Harbor of Refuge Light" -> Harbor of Refuge Light | R30: of:="https://en.wikipedia.org/wiki/Harbor_of_Refuge_Light" -> https://en.wikipedia.org/wiki/Harbor_of_Refuge_Light
A32: of:=DEGREES(ATAN2(COS(RADIANS([.I$2]))*SIN(RADIANS([.I32]))-SIN(RADIANS([.I$2]))*COS(RADIANS([.I32]))*COS(RADIANS([.J32]-[.J$2]));SIN(RADIANS([.J32]-[.J$2]))*COS(RADIANS([.I32])))) -> 22.8872663092405 | B32: of:=MOD([.A32];360) -> 22.8872663092405 | C32: of:=[.B32]*17.777778 -> 406.884739472558 | D32: of:=[.A32]+[.D$2] -> 34.7872663092405 | E32: of:=MOD([.D32];360) -> 34.7872663092405 | F32: of:=[.E32]*17.777778 -> 618.440297672557 | G32: of:=ACOS(SIN(RADIANS([.I$2]))*SIN(RADIANS([.I32]))+COS(RADIANS([.I$2]))*COS(RADIANS([.I32]))*COS(RADIANS([.J32])-RADIANS([.J$2])))*3958.7 -> 9.25530080240672 | H32: of:=[.G32]/1.15 -> 8.04808765426671 | I32: 38.908193333 | J32: -75.03735 | K32: of:="Fl" -> Fl | L32: of:="red" -> red | M32: of:=4 -> 4 | N32: of:=1 -> 1 | O32: of:=1 -> 1 | P32: of:="2" -> 2 | Q32: of:="Cape May Canal West Entrance Approach Lighted Buoy" -> Cape May Canal West Entrance Approach Lighted Buoy
A33: of:=DEGREES(ATAN2(COS(RADIANS([.I$2]))*SIN(RADIANS([.I33]))-SIN(RADIANS([.I$2]))*COS(RADIANS([.I33]))*COS(RADIANS([.J33]-[.J$2]));SIN(RADIANS([.J33]-[.J$2]))*COS(RADIANS([.I33])))) -> 37.0525831878981 | B33: of:=MOD([.A33];360) -> 37.0525831878981 | C33: of:=[.B33]*17.777778 -> 658.712598240985 | D33: of:=[.A33]+[.D$2] -> 48.9525831878981 | E33: of:=MOD([.D33];360) -> 48.9525831878981 | F33: of:=[.E33]*17.777778 -> 870.268156440985 | G33: of:=ACOS(SIN(RADIANS([.I$2]))*SIN(RADIANS([.I33]))+COS(RADIANS([.I$2]))*COS(RADIANS([.I33]))*COS(RADIANS([.J33])-RADIANS([.J$2])))*3958.7 -> 12.8370464737232 | H33: of:=[.G33]/1.15 -> 11.1626491075854 | I33: 38.932995 | J33: -74.960383333 | K33: of:="Fl" -> Fl | L33: of:="white" -> white | M33: of:=15 -> 15 | N33: of:=165 -> 165 | O33: of:=22 -> 22 | P33: of:="" ->  | Q33: of:="Cape May Light" -> Cape May Light | R33: of:="https://capemaymac.org/experience/cape-may-lighthouse/" -> https://capemaymac.org/experience/cape-may-lighthouse/
A34: of:=DEGREES(ATAN2(COS(RADIANS([.I$2]))*SIN(RADIANS([.I34]))-SIN(RADIANS([.I$2]))*COS(RADIANS([.I34]))*COS(RADIANS([.J34]-[.J$2]));SIN(RADIANS([.J34]-[.J$2]))*COS(RADIANS([.I34])))) -> 46.7615635814083 | B34: of:=MOD([.A34];360) -> 46.7615635814083 | C34: of:=[.B34]*17.777778 -> 831.316696283161 | D34: of:=[.A34]+[.D$2] -> 58.6615635814083 | E34: of:=MOD([.D34];360) -> 58.6615635814083 | F34: of:=[.E34]*17.777778 -> 1042.87225448316 | G34: of:=ACOS(SIN(RADIANS([.I$2]))*SIN(RADIANS([.I34]))+COS(RADIANS([.I$2]))*COS(RADIANS([.I34]))*COS(RADIANS([.J34])-RADIANS([.J$2])))*3958.7 -> 0.953229338041463 | H34: of:=[.G34]/1.15 -> 0.828895076557794 | I34: 38.794253333 | J34: -75.091405 | K34: of:="" ->  | L34: of:="" ->  | M34: of:=0 -> 0 | N34: of:=0 -> 0 | O34: of:=0 -> 0 | P34: of:="" ->  | Q34: of:="Delaware Entrance Speaking Station" -> Delaware Entrance Speaking Station | R34: of:="https://www.alamy.com/stock-photo-the-pilot-radar-tower-at-cape-henlopen-state-park-in-delaware-usa-19517490.html" -> https://www.alamy.com/stock-photo-the-pilot-radar-tower-at-cape-henlopen-state-park-in-delaware-usa-19517490.html
A35: of:=DEGREES(ATAN2(COS(RADIANS([.I$2]))*SIN(RADIANS([.I35]))-SIN(RADIANS([.I$2]))*COS(RADIANS([.I35]))*COS(RADIANS([.J35]-[.J$2]));SIN(RADIANS([.J35]-[.J$2]))*COS(RADIANS([.I35])))) -> 52.324290680722 | B35: of:=MOD([.A35];360) -> 52.324290680722 | C35: of:=[.B35]*17.777778 -> 930.209623729345 | D35: of:=[.A35]+[.D$2] -> 64.224290680722 | E35: of:=MOD([.D35];360) -> 64.224290680722 | F35: of:=[.E35]*17.777778 -> 1141.76518192934 | G35: of:=ACOS(SIN(RADIANS([.I$2]))*SIN(RADIANS([.I35]))+COS(RADIANS([.I$2]))*COS(RADIANS([.I35]))*COS(RADIANS([.J35])-RADIANS([.J$2])))*3958.7 -> 4.26204489230685 | H35: of:=[.G35]/1.15 -> 3.70612599331031 | I35: 38.822488333 | J35: -75.041633333 | K35: of:="Fl" -> Fl | L35: of:="red" -> red | M35: of:=2.5 -> 2.5 | N35: of:=1 -> 1 | O35: of:=1 -> 1 | P35: of:="8" -> 8 | Q35: of:="Delaware Bay Entrance Channel Lighted Buoy" -> Delaware Bay Entrance Channel Lighted Buoy
A37: of:=DEGREES(ATAN2(COS(RADIANS([.I$2]))*SIN(RADIANS([.I37]))-SIN(RADIANS([.I$2]))*COS(RADIANS([.I37]))*COS(RADIANS([.J37]-[.J$2]));SIN(RADIANS([.J37]-[.J$2]))*COS(RADIANS([.I37])))) -> -60.2133482504006 | B37: of:=MOD([.A37];360) -> 299.786651749599 | C37: of:=[.B37]*17.777778 -> 5329.54054216769 | D37: of:=[.A37]+[.D$2] -> -48.3133482504007 | E37: of:=MOD([.D37];360) -> 311.686651749599 | F37: of:=[.E37]*17.777778 -> 5541.09610036769 | G37: of:=0 -> 0 | H37: of:=0 -> 0 | I37: 38.983677 | J37: -75.553199 | K37: Iso | L37: of:="red" -> red | M37: of:=3 -> 3 | N37: 519 | O37: of:=0 -> 0 | P37: of:="" ->  | Q37: of:="Delaware Division Of Communications, ASR 1060162, Lake Forest High School, 5423 Killen's Pond Road, Felton" -> Delaware Division Of Communications, ASR 1060162, Lake Forest High School, 5423 Killen's Pond Road, Felton
A38: of:=DEGREES(ATAN2(COS(RADIANS([.I$2]))*SIN(RADIANS([.I38]))-SIN(RADIANS([.I$2]))*COS(RADIANS([.I38]))*COS(RADIANS([.J38]-[.J$2]));SIN(RADIANS([.J38]-[.J$2]))*COS(RADIANS([.I38])))) -> -54.9796047178955 | B38: of:=MOD([.A38];360) -> 305.020395282104 | C38: of:=[.B38]*17.777778 -> 5422.5848727975 | D38: of:=[.A38]+[.D$2] -> -43.0796047178955 | E38: of:=MOD([.D38];360) -> 316.920395282104 | F38: of:=[.E38]*17.777778 -> 5634.1404309975 | G38: of:=0 -> 0 | H38: of:=0 -> 0 | I38: 38.9553668 | J38: -75.4180773 | K38: of:="Fl" -> Fl | L38: of:="red" -> red | M38: of:=2 -> 2 | N38: 262 | O38: of:=0 -> 0 | P38: of:="" ->  | Q38: of:="Comcast Tower, ASR 1051563, 6628 Big Stone Beach Road, Milford" -> Comcast Tower, ASR 1051563, 6628 Big Stone Beach Road, Milford
A39: of:=DEGREES(ATAN2(COS(RADIANS([.I$2]))*SIN(RADIANS([.I39]))-SIN(RADIANS([.I$2]))*COS(RADIANS([.I39]))*COS(RADIANS([.J39]-[.J$2]));SIN(RADIANS([.J39]-[.J$2]))*COS(RADIANS([.I39])))) -> -53.9008213960825 | B39: of:=MOD([.A39];360) -> 306.099178603917 | C39: of:=[.B39]*17.777778 -> 5441.7632432028 | D39: of:=[.A39]+[.D$2] -> -42.0008213960825 | E39: of:=MOD([.D39];360) -> 317.999178603918 | F39: of:=[.E39]*17.777778 -> 5653.3188014028 | G39: of:=0 -> 0 | H39: of:=0 -> 0 | I39: 39.012685 | J39: -75.507725 | K39: of:="Iso" -> Iso | L39: of:="red" -> red | M39: of:=3 -> 3 | N39: 289 | O39: of:=0 -> 0 | P39: of:="" ->  | Q39: of:="ASR 1034028, 3449 Midstate Road, Frederica ??? (was approx. 53.0)" -> ASR 1034028, 3449 Midstate Road, Frederica ??? (was approx. 53.0)
A40: of:=DEGREES(ATAN2(COS(RADIANS([.I$2]))*SIN(RADIANS([.I40]))-SIN(RADIANS([.I$2]))*COS(RADIANS([.I40]))*COS(RADIANS([.J40]-[.J$2]));SIN(RADIANS([.J40]-[.J$2]))*COS(RADIANS([.I40])))) -> -52.5054179617133 | B40: of:=MOD([.A40];360) -> 307.494582038287 | C40: of:=[.B40]*17.777778 -> 5466.57041567945 | D40: of:=[.A40]+[.D$2] -> -40.6054179617133 | E40: of:=MOD([.D40];360) -> 319.394582038287 | F40: of:=[.E40]*17.777778 -> 5678.12597387945 | G40: of:=0 -> 0 | H40: of:=0 -> 0 | I40: 39.063594 | J40: -75.573903 | K40: of:="Fl" -> Fl | L40: of:="red" -> red | M40: of:=3 -> 3 | N40: 524 | O40: of:=0 -> 0 | P40: of:="" ->  | Q40: of:="ASR 1031409, 3462 Henry Cowgill Road, Wyoming ??? (was 51.3)" -> ASR 1031409, 3462 Henry Cowgill Road, Wyoming ??? (was 51.3)
A41: of:=DEGREES(ATAN2(COS(RADIANS([.I$2]))*SIN(RADIANS([.I41]))-SIN(RADIANS([.I$2]))*COS(RADIANS([.I41]))*COS(RADIANS([.J41]-[.J$2]));SIN(RADIANS([.J41]-[.J$2]))*COS(RADIANS([.I41])))) -> -51.0055736219431 | B41: of:=MOD([.A41];360) -> 308.994426378057 | C41: of:=[.B41]*17.777778 -> 5493.23431538644 | D41: of:=[.A41]+[.D$2] -> -39.1055736219431 | E41: of:=MOD([.D41];360) -> 320.894426378057 | F41: of:=[.E41]*17.777778 -> 5704.78987358644 | G41: of:=0 -> 0 | H41: of:=0 -> 0 | I41: 39.06945 | J41: -75.55854 | K41: of:="Fl" -> Fl | L41: of:="white" -> white | M41: of:=1.5 -> 1.5 | N41: 469 | O41: of:=0 -> 0 | P41: of:="" ->  | Q41: of:="American Tower, ASR 1033243, 114 Brians Drive, Woodside" -> American Tower, ASR 1033243, 114 Brians Drive, Woodside
A42: -37 | B42: of:=MOD([.A42];360) -> 323 | C42: of:=[.B42]*17.777778 -> 5742.222294 | D42: of:=[.A42]+[.D$2] -> -25.1 | E42: of:=MOD([.D42];360) -> 334.9 | F42: of:=[.E42]*17.777778 -> 5953.7778522 | G42: of:=0 -> 0 | H42: of:=0 -> 0 | I42: of:=0 -> 0 | J42: of:=0 -> 0 | K42: of:="Oc" -> Oc | L42: of:="red" -> red | M42: of:=6 -> 6 | N42: of:=0 -> 0 | O42: of:=0 -> 0 | P42: of:="" ->  | Q42: of:="unknown (azimuth approx.)" -> unknown (azimuth approx.)
A43: -35 | B43: of:=MOD([.A43];360) -> 325 | C43: of:=[.B43]*17.777778 -> 5777.77785 | D43: of:=[.A43]+[.D$2] -> -23.1 | E43: of:=MOD([.D43];360) -> 336.9 | F43: of:=[.E43]*17.777778 -> 5989.3334082 | G43: of:=0 -> 0 | H43: of:=0 -> 0 | I43: of:=0 -> 0 | J43: of:=0 -> 0 | K43: of:="Fl" -> Fl | L43: of:="red" -> red | M43: of:=2 -> 2 | N43: of:=0 -> 0 | O43: of:=0 -> 0 | P43: of:="" ->  | Q43: of:="unknown (azimuth approx.)" -> unknown (azimuth approx.)
A45: of:=30.8 -> 30.8 | B45: of:=MOD([.A45];360) -> 30.8 | C45: of:=[.B45]*17.777778 -> 547.5555624 | D45: of:=[.A45]+[.D$2] -> 42.7 | E45: of:=MOD([.D45];360) -> 42.7 | F45: of:=[.E45]*17.777778 -> 759.1111206 | G45: of:=0 -> 0 | H45: of:=0 -> 0 | I45: of:=0 -> 0 | J45: of:=0 -> 0 | K45: of:="Fl" -> Fl | L45: of:="red" -> red | M45: of:=2.5 -> 2.5 | N45: of:=0 -> 0 | O45: of:=0 -> 0 | P45: of:="" ->  | Q45: of:="unknown (azimuth approx.)" -> unknown (azimuth approx.)
A46: of:=31 -> 31 | B46: of:=MOD([.A46];360) -> 31 | C46: of:=[.B46]*17.777778 -> 551.111118 | D46: of:=[.A46]+[.D$2] -> 42.9 | E46: of:=MOD([.D46];360) -> 42.9 | F46: of:=[.E46]*17.777778 -> 762.6666762 | G46: of:=0 -> 0 | H46: of:=0 -> 0 | I46: of:=0 -> 0 | J46: of:=0 -> 0 | K46: of:="Oc" -> Oc | L46: of:="red" -> red | M46: of:=3 -> 3 | N46: of:=0 -> 0 | O46: of:=0 -> 0 | P46: of:="" ->  | Q46: of:="unknown (azimuth approx.)" -> unknown (azimuth approx.)
A47: of:=32 -> 32 | B47: of:=MOD([.A47];360) -> 32 | C47: of:=[.B47]*17.777778 -> 568.888896 | D47: of:=[.A47]+[.D$2] -> 43.9 | E47: of:=MOD([.D47];360) -> 43.9 | F47: of:=[.E47]*17.777778 -> 780.4444542 | G47: of:=0 -> 0 | H47: of:=0 -> 0 | I47: of:=0 -> 0 | J47: of:=0 -> 0 | K47: of:="Fl" -> Fl | L47: of:="red" -> red | M47: of:=4 -> 4 | N47: of:=0 -> 0 | O47: of:=0 -> 0 | P47: of:="" ->  | Q47: of:="unknown (azimuth approx.)" -> unknown (azimuth approx.)
A48: of:=33 -> 33 | B48: of:=MOD([.A48];360) -> 33 | C48: of:=[.B48]*17.777778 -> 586.666674 | D48: of:=[.A48]+[.D$2] -> 44.9 | E48: of:=MOD([.D48];360) -> 44.9 | F48: of:=[.E48]*17.777778 -> 798.2222322 | G48: of:=0 -> 0 | H48: of:=0 -> 0 | I48: of:=0 -> 0 | J48: of:=0 -> 0 | K48: of:="Fl" -> Fl | L48: of:="red" -> red | M48: of:=3 -> 3 | N48: of:=0 -> 0 | O48: of:=0 -> 0 | P48: of:="" ->  | Q48: of:="unknown (azimuth approx.)" -> unknown (azimuth approx.)
A49: of:=34.1 -> 34.1 | B49: of:=MOD([.A49];360) -> 34.1 | C49: of:=[.B49]*17.777778 -> 606.2222298 | D49: of:=[.A49]+[.D$2] -> 46 | E49: of:=MOD([.D49];360) -> 46 | F49: of:=[.E49]*17.777778 -> 817.777788 | G49: of:=0 -> 0 | H49: of:=0 -> 0 | I49: of:=0 -> 0 | J49: of:=0 -> 0 | K49: of:="Iso" -> Iso | L49: of:="red" -> red | M49: of:=2.6 -> 2.6 | N49: of:=0 -> 0 | O49: of:=0 -> 0 | P49: of:="" ->  | Q49: of:="unknown" -> unknown
A50: of:=35.5 -> 35.5 | B50: of:=MOD([.A50];360) -> 35.5 | C50: of:=[.B50]*17.777778 -> 631.111119 | D50: of:=[.A50]+[.D$2] -> 47.4 | E50: of:=MOD([.D50];360) -> 47.4 | F50: of:=[.E50]*17.777778 -> 842.6666772 | G50: of:=0 -> 0 | H50: of:=0 -> 0 | I50: of:=0 -> 0 | J50: of:=0 -> 0 | K50: of:="Fl" -> Fl | L50: of:="red" -> red | M50: of:=2 -> 2 | N50: of:=0 -> 0 | O50: of:=0 -> 0 | P50: of:="" ->  | Q50: of:="unknown" -> unknown
A51: of:=36.2 -> 36.2 | B51: of:=MOD([.A51];360) -> 36.2 | C51: of:=[.B51]*17.777778 -> 643.5555636 | D51: of:=[.A51]+[.D$2] -> 48.1 | E51: of:=MOD([.D51];360) -> 48.1 | F51: of:=[.E51]*17.777778 -> 855.1111218 | G51: of:=0 -> 0 | H51: of:=0 -> 0 | I51: of:=0 -> 0 | J51: of:=0 -> 0 | K51: of:="Fl" -> Fl | L51: of:="red" -> red | M51: of:=3 -> 3 | N51: of:=0 -> 0 | O51: of:=0 -> 0 | P51: of:="" ->  | Q51: of:="unknown" -> unknown
A52: of:=39.2 -> 39.2 | B52: of:=MOD([.A52];360) -> 39.2 | C52: of:=[.B52]*17.777778 -> 696.8888976 | D52: of:=[.A52]+[.D$2] -> 51.1 | E52: of:=MOD([.D52];360) -> 51.1 | F52: of:=[.E52]*17.777778 -> 908.4444558 | G52: of:=0 -> 0 | H52: of:=0 -> 0 | I52: of:=0 -> 0 | J52: of:=0 -> 0 | K52: of:="Fl" -> Fl | L52: of:="red" -> red | M52: of:=3 -> 3 | N52: of:=0 -> 0 | O52: of:=0 -> 0 | P52: of:="" ->  | Q52: of:="unknown" -> unknown
A53: of:=39.3 -> 39.3 | B53: of:=MOD([.A53];360) -> 39.3 | C53: of:=[.B53]*17.777778 -> 698.6666754 | D53: of:=[.A53]+[.D$2] -> 51.2 | E53: of:=MOD([.D53];360) -> 51.2 | F53: of:=[.E53]*17.777778 -> 910.2222336 | G53: of:=0 -> 0 | H53: of:=0 -> 0 | I53: of:=0 -> 0 | J53: of:=0 -> 0 | K53: of:="Fl" -> Fl | L53: of:="red" -> red | M53: of:=3 -> 3 | N53: of:=0 -> 0 | O53: of:=0 -> 0 | P53: of:="" ->  | Q53: of:="unknown" -> unknown
A55: of:=DEGREES(ATAN2(COS(RADIANS([.I$2]))*SIN(RADIANS([.I55]))-SIN(RADIANS([.I$2]))*COS(RADIANS([.I55]))*COS(RADIANS([.J55]-[.J$2]));SIN(RADIANS([.J55]-[.J$2]))*COS(RADIANS([.I55])))) -> -92.2864835728389 | B55: of:=MOD([.A55];360) -> 267.713516427161 | C55: of:=[.B55]*17.777778 -> 4759.35146264142 | D55: of:=[.A55]+[.D$2] -> -80.3864835728389 | E55: of:=MOD([.D55];360) -> 279.613516427161 | F55: of:=[.E55]*17.777778 -> 4970.90702084142 | G55: of:=ACOS(SIN(RADIANS([.I$2]))*SIN(RADIANS([.I55]))+COS(RADIANS([.I$2]))*COS(RADIANS([.I55]))*COS(RADIANS([.J55])-RADIANS([.J$2])))*3958.7 -> 3.26181101445962 | H55: of:=[.G55]/1.15 -> 2.83635740387793 | I55: of:=38.7829039 -> 38.7829039 | J55: of:=-75.1648142 -> -75.1648142 | K55: of:="Fl" -> Fl | L55: of:="red" -> red | M55: of:=3 -> 3 | N55: of:=400 -> 400 | O55: of:=0 -> 0 | P55: of:="" ->  | Q55: of:="University of Delaware wind turbine" -> University of Delaware wind turbine | R55: of:="https://publicutility.ceoe.udel.edu/lewesturbine/" -> https://publicutility.ceoe.udel.edu/lewesturbine/
A57: of:=DEGREES(ATAN2(COS(RADIANS([.I$2]))*SIN(RADIANS([.I57]))-SIN(RADIANS([.I$2]))*COS(RADIANS([.I57]))*COS(RADIANS([.J57]-[.J$2]));SIN(RADIANS([.J57]-[.J$2]))*COS(RADIANS([.I57])))) -> -93.1284015063048 | B57: of:=MOD([.A57];360) -> 266.871598493695 | C57: of:=[.B57]*17.777778 -> 4744.38403252605 | D57: of:=[.A57]+[.D$2] -> -81.2284015063048 | E57: of:=MOD([.D57];360) -> 278.771598493695 | F57: of:=[.E57]*17.777778 -> 4955.93959072605 | G57: of:=ACOS(SIN(RADIANS([.I$2]))*SIN(RADIANS([.I57]))+COS(RADIANS([.I$2]))*COS(RADIANS([.I57]))*COS(RADIANS([.J57])-RADIANS([.J$2])))*3958.7 -> 12.8359734507751 | H57: of:=[.G57]/1.15 -> 11.1617160441523 | I57: 38.774423 | J57: -75.342242 | K57: of:="Iso" -> Iso | L57: of:="red" -> red | M57: of:=3 -> 3 | N57: of:=337 -> 337 | O57: of:=0 -> 0 | Q57: of:="Delaware Division Of Communications, ASR 1060468, Gravel Hill Road at Lancaster Lane, Milton" -> Delaware Division Of Communications, ASR 1060468, Gravel Hill Road at Lancaster Lane, Milton
A59: 4.3 | B59: of:=MOD([.A59];360) -> 4.3 | C59: of:=[.B59]*17.777778 -> 76.4444454 | D59: of:=[.A59]+[.D$2] -> 16.2 | E59: of:=MOD([.D59];360) -> 16.2 | F59: of:=[.E59]*17.777778 -> 288.0000036 | G59: of:=0 -> 0 | H59: of:=0 -> 0 | I59: of:=0 -> 0 | J59: of:=0 -> 0 | K59: of:="Iso" -> Iso | L59: of:="white" -> white | M59: of:=6 -> 6 | N59: of:=0 -> 0 | O59: of:=0 -> 0 | Q59: of:="end of pier light B?" -> end of pier light B?
A60: 5 | B60: of:=MOD([.A60];360) -> 5 | C60: of:=[.B60]*17.777778 -> 88.88889 | D60: of:=[.A60]+[.D$2] -> 16.9 | E60: of:=MOD([.D60];360) -> 16.9 | F60: of:=[.E60]*17.777778 -> 300.4444482 | G60: of:=0 -> 0 | H60: of:=0 -> 0 | I60: of:=0 -> 0 | J60: of:=0 -> 0 | K60: of:="Q" -> Q | L60: of:="white" -> white | M60: of:=0.94 -> 0.94 | N60: of:=0 -> 0 | O60: of:=0 -> 0 | Q60: of:="end of pier quick (azimuth approx.)”" -> end of pier quick (azimuth approx.)”
A61: 8.3 | B61: of:=MOD([.A61];360) -> 8.3 | C61: of:=[.B61]*17.777778 -> 147.5555574 | D61: of:=[.A61]+[.D$2] -> 20.2 | E61: of:=MOD([.D61];360) -> 20.2 | F61: of:=[.E61]*17.777778 -> 359.1111156 | G61: of:=0 -> 0 | H61: of:=0 -> 0 | I61: of:=0 -> 0 | J61: of:=0 -> 0 | K61: of:="Iso" -> Iso | L61: of:="white" -> white | M61: of:=6 -> 6 | N61: of:=0 -> 0 | O61: of:=0 -> 0 | Q61: of:="end of pier light C?" -> end of pier light C?